{
  "$schema": "https://roblox-top1.local/schemas/visual-canon-source.schema.json",
  "schemaVersion": "2.0.0",
  "authoredAt": "2026-07-18T09:05:09Z",
  "authoredBy": "Codex under founder authority; human lock still required",
  "authority": {
    "productArtContract": {
      "path": "art/authority/product-art-authority-v1.json",
      "sha256": "217c95da6202e43ad542094bcc2389493748c9d4bc9045e95647de9b6d98e2ca"
    },
    "retention": {
      "path": "docs/PRODUCT_INNOVATION_AND_RETENTION_DOCTRINE.md",
      "sha256": "b1b045849e5540cea71c7a9965f5e16351168b25e50550e5bafea40d832bc5ad"
    },
    "objectProductContracts": {
      "path": "art/canonical-visuals/object-product-contracts.json",
      "sha256": "4bc2a2657e9b5086f820ece02bf502b8c781c9bdddd5dda711a27acc499c2184"
    },
    "artDirection": {
      "path": "art/art-direction.json",
      "sha256": "ab1e3b2607fc916fa660fb20b90c2b62ee6985a866c3a65090bef4996a7eef22"
    },
    "calibration": {
      "path": "art/calibration/calibration-kit.json",
      "sha256": "8a33c6c8a9b5a02ef460f5e698907a4d6d623e2f5c475047cd3dbdccc102ace9"
    },
    "shapeLanguage": {
      "path": "art/shape-language/rules.json",
      "sha256": "76fcd0eaaace7f34d7fb88fdc6470315518efd8e586649393ceb32356a7addc7"
    },
    "materials": {
      "path": "art/materials/material-rules.json",
      "sha256": "41fadb667eb50a2252e6721649afee1b38b98a667ea7c2051f5f465ad9896b83"
    },
    "selectedConstitution": {
      "path": "art/selected/salvaged-frontier-constitution.json",
      "sha256": "1a7ea88c2d06be01530b6e02b70b6f9dc176f5b74d0cb98f4d565b8a322a9491"
    }
  },
  "visualPacketBoards": [
    "orthographic",
    "perspective",
    "black_silhouette",
    "component_breakdown",
    "proportions",
    "materials",
    "semantic_zones",
    "all_states",
    "state_comparison",
    "mobile_near",
    "mobile_mid",
    "mobile_far",
    "lighting_matrix",
    "repetition_1",
    "repetition_30",
    "repetition_100",
    "required_and_forbidden_annotations"
  ],
  "assets": {
    "barricade": {
      "canonicalName": "Defense Barricade Small",
      "category": "player_buildable_defense",
      "worldRole": "A temporary, deliberately understandable interruption in the enemy route that turns path control into a visible player-authored hypothesis.",
      "affiliation": "player_fortress",
      "manufactureContext": "Built rapidly in the fortress workshop from standardized structural modules intended to be repaired, replaced and visibly tested under pressure.",
      "emotionalIntent": "Dependable and brave without appearing invulnerable; its damage should create urgency and useful concern rather than helplessness.",
      "technologyLevel": "rugged modular near-future workshop technology",
      "character": [
        "stubborn",
        "protective",
        "repairable",
        "plain-spoken"
      ],
      "oneSecondPromise": "This broad grounded object blocks a lane now, shows where it is weakening, and can be understood before the next enemy reaches it.",
      "orientationCue": "The reinforced presentation face addresses incoming enemies; the flatter service face and interaction light address the player.",
      "interactionCue": "A complete, waist-height service socket or status module is readable from the safe rear side.",
      "dangerCue": "Breaks, tilted panels and exposed structure progress from one localized weakness to a wide critical breach.",
      "relationToPlayer": "Friendly player-built infrastructure that invites repair and repositioning rather than fear.",
      "proportionRules": [
        "The full width remains exactly twice the height and four times the depth.",
        "The two feet occupy the outer thirds and keep a clear central ground gap.",
        "The blocking panels occupy most of the frontal area while the frame remains the silhouette authority.",
        "The interaction module stays above the player's ground clutter and below the top rail."
      ],
      "viewDescriptions": {
        "front": "A wide low fortress gate fragment: two planted feet, two outer posts, strong top and bottom rails, and three readable blocking bays facing the enemy.",
        "back": "A calmer service plane with visible frame continuity, repair access and the interaction module; it must never resemble the enemy-facing impact side.",
        "left": "A compact planted wedge showing the foot depth, post thickness and credible connection between panel, rail and ground contact.",
        "right": "The mirrored functional profile with only approved territory asymmetry; no cable, plate or damage fragment may float outside the structural chain.",
        "top": "A shallow defensive bar with two stable footprints and a clear front-to-back distinction created by impact armor versus service mass.",
        "bottom": "Only grounded feet, underslung rail structure and intentional clearances are visible; no decorative underside detail consumes budget.",
        "threeQuarterFront": "The canonical hero read combines broad blocking silhouette, panel rhythm, planted feet and the enemy-facing reinforcement logic.",
        "threeQuarterBack": "The service read exposes repair logic and interaction access while preserving the same outer silhouette and footprint.",
        "gameCamera": "From elevated third-person mobile view, the object reads as one broad lane blocker with three state-readable bays, not as a pile of small parts."
      },
      "recognitionLandmarks": [
        "broad eight-stud blocking span",
        "two heavy outer feet",
        "three-panel rhythm inside a continuous frame",
        "rear service interaction module"
      ],
      "negativeSpaces": [
        "ground clearance between the two feet",
        "controlled gaps separating the three bays",
        "small service recess around the rear interaction module"
      ],
      "primaryForms": [
        "wide rectangular structural frame",
        "three chunky blocking panel masses",
        "two low stabilizing feet"
      ],
      "secondaryForms": [
        "outer posts and cross rails explaining load paths",
        "rear braces connecting frame to feet",
        "service socket and protected status light"
      ],
      "tertiaryForms": [
        "few large fasteners at real joints",
        "controlled edge wear at impact and repair contacts",
        "tertiary detail only at real joints; no standalone emblem, badge or assembly mark"
      ],
      "components": [
        {
          "id": "FoundationFeet",
          "function": "Transfer impact load to the ground and define the collision footprint.",
          "position": "outer lower thirds",
          "form": "two broad low feet",
          "materialRole": "rubber",
          "relationship": "Mechanically joined to the outer frame posts through visible load-bearing brackets.",
          "mobility": "fixed",
          "visibility": "Visible from front, sides and game camera.",
          "readingRole": "Signals stability and makes the lane-blocking footprint honest."
        },
        {
          "id": "StructuralFrame",
          "function": "Carry the barricade silhouette and preserve identity across all damage states.",
          "position": "full perimeter",
          "form": "wide rectangular frame",
          "materialRole": "primary",
          "relationship": "Connects feet, posts, rails and every blocking bay into one repairable chassis.",
          "mobility": "destructible",
          "visibility": "Visible from every meaningful angle.",
          "readingRole": "Primary silhouette authority and invariant identity carrier."
        },
        {
          "id": "BlockingPanels",
          "function": "Present the enemy-facing impact area and communicate localized structural damage.",
          "position": "three central bays",
          "form": "three thick inset panels",
          "materialRole": "secondary",
          "relationship": "Captured inside the frame with readable hinges, clamps or brackets.",
          "mobility": "destructible",
          "visibility": "Dominant from front and game camera; partially visible from rear.",
          "readingRole": "Explains what physically blocks enemies and where failure begins."
        },
        {
          "id": "ServiceModule",
          "function": "Expose the player-facing repair and status interaction point.",
          "position": "rear upper-right quadrant",
          "form": "protected socket or complete ring",
          "materialRole": "interaction",
          "relationship": "Mounted to the structural frame, never to a disposable panel.",
          "mobility": "replaceable",
          "visibility": "Clearly visible from rear and three-quarter rear.",
          "readingRole": "Separates friendly interaction from enemy-facing armor."
        }
      ],
      "semanticZones": [
        {
          "id": "structural_zone",
          "purpose": "Communicate the load-bearing chassis that persists through damage.",
          "shapeRule": "Continuous thick frame and planted feet.",
          "valueRule": "Dark stable value mass.",
          "colorRole": "primary",
          "motionRule": "mostly still",
          "vfxAnchor": "frame_joints",
          "audioRole": "heavy_structure"
        },
        {
          "id": "blocking_zone",
          "purpose": "Show where enemies are physically stopped and where breaches form.",
          "shapeRule": "Three broad readable bays.",
          "valueRule": "Mid-value panels separated from frame.",
          "colorRole": "secondary",
          "motionRule": "breaks only",
          "vfxAnchor": "panel_impacts",
          "audioRole": "panel_impacts"
        },
        {
          "id": "interaction_zone",
          "purpose": "Guide repair and status interaction from the safe side.",
          "shapeRule": "Complete socket when usable and open socket when disabled.",
          "valueRule": "Small high-contrast focal point.",